{
  "$schema": "https://json-schema.org/draft/2020-12/schema",
  "$id": "https://raw.githubusercontent.com/lannerk/agent-catalog/main/mcp/servers.schema.json",
  "title": "agent-catalog MCP mirror manifest (schema 1)",
  "description": "mcp/servers.json: when the mirror of the official MCP Registry was brought up to date, how many servers it holds, and its 16 shard files (mcp/servers/<0-f>.json, by the first hex digit of sha256(name)).",
  "type": "object",
  "additionalProperties": false,
  "required": ["schema", "source", "synced_at", "count", "shards"],
  "properties": {
    "schema": { "const": 1 },
    "source": { "type": "string", "format": "uri" },
    "synced_at": { "type": "string", "pattern": "^\\d{4}-\\d{2}-\\d{2}T\\d{2}:\\d{2}:\\d{2}Z$" },
    "count": { "type": "integer", "minimum": 0 },
    "shards": {
      "type": "object",
      "additionalProperties": false,
      "propertyNames": { "pattern": "^[0-9a-f]$" },
      "minProperties": 16,
      "patternProperties": {
        "^[0-9a-f]$": {
          "type": "object",
          "additionalProperties": false,
          "required": ["count", "sha256"],
          "properties": {
            "count": { "type": "integer", "minimum": 0 },
            "sha256": { "type": "string", "pattern": "^[0-9a-f]{64}$" }
          }
        }
      }
    }
  }
}
