{
 "schema": 1,
 "source": "https://registry.modelcontextprotocol.io/v0.1/servers",
 "synced_at": "2026-10-30T22:58:54Z",
 "count": 52902,
 "shards": {
  "0": {
   "count": 3331,
   "sha256": "3fda7b5e46eba87ccda319c8f120f28a08cd4d069da61648ca621a7726131c66"
  },
  "1": {
   "count": 3225,
   "sha256": "fbcbd123fe194f4bd4fd236745fd7c98618fe5d512c6eb2038eef23d6512dbdd"
  },
  "2": {
   "count": 3238,
   "sha256": "6f30a753ced198329010b60d5d53f39d4744c1ea1076ae8350dcff6d1c026c6f"
  },
  "3": {
   "count": 3310,
   "sha256": "a9085555e224b1fad9212592ba01dd961d5aa53eb3b721d796263c756b7ce39f"
  },
  "4": {
   "count": 3333,
   "sha256": "d5640b36cb375c4c7c45023cd30ba004f2ed02bda16cd0817d9b13cc74ea89a3"
  },
  "5": {
   "count": 3229,
   "sha256": "d928bd283d292f0a04647cc8457f445b38bdba9ce3d5810d187cad21473693a8"
  },
  "6": {
   "count": 3307,
   "sha256": "c5b47df72dafb56f9b704a07fd9fb0f2c173c6e230fa68f9e95fa0eca5ddfd8a"
  },
  "7": {
   "count": 3362,
   "sha256": "e7c427aa3a343096351c62090b19b6b115a38e5d11a11df5cc820d22e48a5664"
  },
  "8": {
   "count": 3417,
   "sha256": "ea5349cf3f65fe6f24f13942fe3ff0e7f97acef7ee5ee394a8275750775ab98f"
  },
  "9": {
   "count": 3193,
   "sha256": "dd45c80604c0f31b469be10394294419fc5c4953572fc729adce89fc130656c5"
  },
  "a": {
   "count": 3286,
   "sha256": "9410030ce3e2754e45a9df505bc019e854894968ddbc44e9d75d5b9c97a3dfee"
  },
  "b": {
   "count": 3305,
   "sha256": "3e110cae81f20e2c97878d48c872961d52c5def2958a5155080741cebea27314"
  },
  "c": {
   "count": 3328,
   "sha256": "3aef96d5c7ff7bde30cbe65a59c309422a57771609beccd1daf29481ae6f0bdc"
  },
  "d": {
   "count": 3343,
   "sha256": "fbd75b02cff1a28ce5fde47ca5fb9b5255b714d3531384dd87af906abeed08ee"
  },
  "e": {
   "count": 3376,
   "sha256": "c2a599a16b23f8dc93d1e16658df40c19be400abce5350654026ec107224899e"
  },
  "f": {
   "count": 3319,
   "sha256": "0d7c2ddeddd0b5a41593b50e705a5823679291536d959e7631be5c0738256b6e"
  }
 }
}
